id,title,score,num_comments,author,created_utc,url,over_18,edited,spoiler,stickied
1cx4mbl,Do you guys think he has a point?,80,43,adritandon01,2024-05-21 10:29:41,https://i.redd.it/tpt8w00kbr1d1.jpeg,False,False,False,False
1cwij5d,"Any good sources for staying up to date (bleeding edge, actually) on data engineering related topics?",39,17,DuckDatum,2024-05-20 15:37:34,https://www.reddit.com/r/dataengineering/comments/1cwij5d/any_good_sources_for_staying_up_to_date_bleeding/,False,False,False,False
1cx6v6y,Hot take: you can't do good data engineering without Git,43,27,RCdeWit,2024-05-21 12:37:48,https://www.reddit.com/r/dataengineering/comments/1cx6v6y/hot_take_you_cant_do_good_data_engineering/,False,False,False,False
1cwsvot,Low/No Code ETL Tools vs Code Based On Companies Tech Maturity,30,29,IrresistibleMittens,2024-05-20 22:51:35,https://www.reddit.com/r/dataengineering/comments/1cwsvot/lowno_code_etl_tools_vs_code_based_on_companies/,False,False,False,False
1cwx0fx,Dimensional vs 3NF Data Models,29,27,kentmaxwell,2024-05-21 02:12:59,https://www.reddit.com/r/dataengineering/comments/1cwx0fx/dimensional_vs_3nf_data_models/,False,False,False,False
1cwncgu,Easiest way to identify fields causing duplicate in a large table ?,20,27,Advanced_Addition321,2024-05-20 18:59:03,https://www.reddit.com/r/dataengineering/comments/1cwncgu/easiest_way_to_identify_fields_causing_duplicate/,False,False,False,False
1cwm3g3,Any tips on how to from Data Engineer role to Data Architect role,17,12,No_Requirement_9200,2024-05-20 18:07:19,https://www.reddit.com/r/dataengineering/comments/1cwm3g3/any_tips_on_how_to_from_data_engineer_role_to/,False,False,False,False
1cwy3mp,Please help settle argument over Redshift Tables,7,5,Bond-0069,2024-05-21 03:10:52,https://www.reddit.com/r/dataengineering/comments/1cwy3mp/please_help_settle_argument_over_redshift_tables/,False,False,False,False
1cx24fi,"How Amazon built a high-performant, durable, & consistent in-memory database ?",4,0,eloraalobrylla,2024-05-21 07:26:56,https://open.substack.com/pub/engineeringatscale/p/how-amazon-built-a-high-performant,False,False,False,False
1cwvj2w,Seeking advice on my Data Engineering learning plan,5,4,Mysterious_Charity99,2024-05-21 00:58:20,https://www.reddit.com/r/dataengineering/comments/1cwvj2w/seeking_advice_on_my_data_engineering_learning/,False,False,False,False
1cx47em,Best SQL Client for dbr-core,4,3,Entire-Molasses8469,2024-05-21 10:01:55,https://www.reddit.com/r/dataengineering/comments/1cx47em/best_sql_client_for_dbrcore/,False,False,False,False
1cx3lo7,Seeking Advice for Career Decision,3,0,uncleoogie,2024-05-21 09:17:15,https://www.reddit.com/r/dataengineering/comments/1cx3lo7/seeking_advice_for_career_decision/,False,False,False,False
1cwzyl4,Addressing skill gaps in data mesh architecture,3,2,nearlybunny,2024-05-21 05:00:47,https://www.reddit.com/r/dataengineering/comments/1cwzyl4/addressing_skill_gaps_in_data_mesh_architecture/,False,False,False,False
1cwtvs0,Ibis: Unified dataframe API for different data backends,3,0,AMDataLake,2024-05-20 23:37:59,https://youtu.be/Hb7KNDT5ZMU,False,False,False,False
1cwkua1,Looking for recommendations for data engineering and GCP Books,3,2,buangakun3,2024-05-20 17:15:01,https://www.reddit.com/r/dataengineering/comments/1cwkua1/looking_for_recommendations_for_data_engineering/,False,False,False,False
1cwpg8u,Opensearch or Aurora Postgresql for Time Series Data?,2,0,candyman_forever,2024-05-20 20:24:37,https://www.reddit.com/r/dataengineering/comments/1cwpg8u/opensearch_or_aurora_postgresql_for_time_series/,False,False,False,False
1cwj9pu,Data Mapping Requirements Template,2,2,ForMrKite,2024-05-20 16:08:55,https://www.reddit.com/r/dataengineering/comments/1cwj9pu/data_mapping_requirements_template/,False,False,False,False
1cwh5mr,Skills needed for data engineering - 2024,3,4,GreatestManEver99,2024-05-20 14:38:31,https://www.reddit.com/r/dataengineering/comments/1cwh5mr/skills_needed_for_data_engineering_2024/,False,False,False,False
1cx89qr,Branch specific variables in Palantir,2,0,sneekeeei,2024-05-21 13:44:53,https://www.reddit.com/r/dataengineering/comments/1cx89qr/branch_specific_variables_in_palantir/,False,False,False,False
1cx7z4b,anyone has an idea what's a PowerUser leader supposed to mean?,1,0,ARA-GOD,2024-05-21 13:30:56,https://www.reddit.com/r/dataengineering/comments/1cx7z4b/anyone_has_an_idea_whats_a_poweruser_leader/,False,False,False,False
1cx79vl,Data Quality Questions,2,0,ShaveTheTurtles,2024-05-21 12:58:02,https://www.reddit.com/r/dataengineering/comments/1cx79vl/data_quality_questions/,False,False,False,False
1cx6w1l,Wrote an article on how to leverage AI when webscraping. Any of y'all do this?,2,0,engineer_of-sorts,2024-05-21 12:39:00,https://www.reddit.com/r/dataengineering/comments/1cx6w1l/wrote_an_article_on_how_to_leverage_ai_when/,False,False,False,False
1cx2psw,Resources to learn advanced Spark?,2,3,randomusicjunkie,2024-05-21 08:10:51,https://www.reddit.com/r/dataengineering/comments/1cx2psw/resources_to_learn_advanced_spark/,False,False,False,False
1cx2prf,How to handle ad hoc data deliveries when implementing a new data warehouse strategy?,1,0,rick854,2024-05-21 08:10:46,https://www.reddit.com/r/dataengineering/comments/1cx2prf/how_to_handle_ad_hoc_data_deliveries_when/,False,False,False,False
1cx2dar,A question about graph databases,1,4,za3b,2024-05-21 07:45:38,https://www.reddit.com/r/dataengineering/comments/1cx2dar/a_question_about_graph_databases/,False,False,False,False
1cwjoqw,Merge small files before ingestion? ,1,0,Classic_Bell_6182,2024-05-20 16:26:33,https://www.reddit.com/r/dataengineering/comments/1cwjoqw/merge_small_files_before_ingestion/,False,False,False,False
1cwhc9i,Delta Lake MERGE INTO will hang Spark session without result (10000 columns),1,0,Spiritual-Water-6590,2024-05-20 14:46:47,https://www.reddit.com/r/dataengineering/comments/1cwhc9i/delta_lake_merge_into_will_hang_spark_session/,False,False,False,False
1cx5bo4,Anyone implemented DATSIS Score in their Data Mesh Architecture?,0,0,Azar_e,2024-05-21 11:13:26,https://www.reddit.com/r/dataengineering/comments/1cx5bo4/anyone_implemented_datsis_score_in_their_data/,False,False,False,False
1cwzerc,Survey collection school project.,0,0,Koufaxxi,2024-05-21 04:26:09,https://www.reddit.com/r/dataengineering/comments/1cwzerc/survey_collection_school_project/,False,False,False,False
